age,workclass,fnlwgt,education,education_num,marital_status,occupation,relationship,race,sex,capital_gain,capital_loss,hours_per_week,native_country,income,manager_comments
67,,159542,5th-6th,3,Widowed,,Unmarried,Black,Female,0,0,40,United-States,<=50K,Bryan Davis flagged a conflict with Gregory Meyer. Mediation scheduled. HR follow-up: [EMAIL].
48,Private,101684,HS-grad,9,Married-civ-spouse,Sales,Husband,White,Male,0,0,40,United-States,<=50K,Barbara Walls requested a transfer. Approved by Dean Dunlap. Reach them at [PHONE] for handover. Ticket HR-24680.
49,Self-emp-not-inc,99335,Some-college,10,Married-civ-spouse,Sales,Husband,White,Male,0,0,50,United-States,<=50K,Strong year for Haley Morgan. Bonus wired to account [IBAN]. Validated by Benjamin Foster on 2025-02-11.
58,Self-emp-not-inc,143731,HS-grad,9,Married-civ-spouse,Sales,Husband,White,Male,0,0,72,United-States,>50K,Plan d'accompagnement ouvert pour Tina Frank. Coaching confié à Taylor Powell ([EMAIL]).
39,Private,245053,Bachelors,13,Married-civ-spouse,Prof-specialty,Husband,White,Male,0,0,50,United-States,>50K,Strong year for Jeffery Woodward. Bonus wired to account [IBAN]. Validated by Tamara Payne on 2025-08-03.
38,State-gov,31352,Some-college,10,Divorced,Protective-serv,Unmarried,Amer-Indian-Eskimo,Female,0,0,40,United-States,>50K,"Annual review for Kristina Davis: solid contributor, no concern. Manager: Rachel Shannon, contact [EMAIL]."
75,Self-emp-inc,125197,HS-grad,9,Married-civ-spouse,Adm-clerical,Husband,White,Male,0,0,26,United-States,<=50K,Behavioral concern raised by colleague John Trevino. Manager Robert Jackson ([EMAIL]) to follow up by 2025-07-13. Reference ticket HR-65938.
26,Private,324854,Bachelors,13,Never-married,Prof-specialty,Not-in-family,White,Female,0,0,40,United-States,>50K,Aaron Brown requested a transfer. Approved by Elizabeth Frank. Reach them at [PHONE] for handover. Ticket HR-20125.
37,Private,259785,Masters,14,Married-civ-spouse,Exec-managerial,Husband,White,Male,0,0,50,United-States,>50K,Alerte comportementale signalée par Matthew Sweeney au sujet James Stewart. Suivi RH : [EMAIL].
48,Self-emp-inc,481987,10th,6,Married-civ-spouse,Exec-managerial,Husband,White,Male,0,0,40,United-States,<=50K,Prime versée à Paulette Gosselin-Delahaye sur le compte [IBAN]. Contrôle : Deanna Ball.
23,Private,149224,HS-grad,9,Never-married,Sales,Not-in-family,White,Male,0,0,40,United-States,<=50K,Performance below target for Nicole Butler. Action plan owned by Tracy Pena. Ticket HR-34302.
23,Private,65481,HS-grad,9,Married-civ-spouse,Machine-op-inspct,Wife,White,Female,0,0,40,United-States,>50K,Alerte comportementale signalée par Daniel Bennett au sujet de Sabine Rey du Grondin. Suivi RH : [EMAIL].
34,Private,261799,Assoc-voc,11,Married-civ-spouse,Adm-clerical,Husband,Black,Male,0,0,45,United-States,>50K,RAS pour Cynthia Harvey cette année. Manager : Philippine de la Duval.
55,Self-emp-not-inc,95149,Some-college,10,Married-civ-spouse,Transport-moving,Husband,White,Male,0,0,99,United-States,<=50K,Onboarding complete for Autumn Woodward. Buddy assigned: Debbie Weber ([EMAIL]). No issues.
39,Private,225330,Bachelors,13,Widowed,Prof-specialty,Unmarried,White,Female,0,0,50,Poland,>50K,"Jonathan Mckenzie on extended leave since 2025-07-20. Donald Lopez II discussed with Kevin Holmes, [PHONE]."
55,Private,160662,Doctorate,16,Married-civ-spouse,Exec-managerial,Husband,White,Male,0,0,80,United-States,>50K,"Annual review for Ashley Jones: solid contributor, no concern. Manager: Margaret Snow, contact [EMAIL]."
65,,106910,11th,7,Divorced,,Not-in-family,Asian-Pac-Islander,Female,0,0,15,United-States,<=50K,"Kevin Fox on extended leave since 2025-03-16. Robert Burton discussed with David Jensen, [PHONE]."
26,Private,167761,Bachelors,13,Married-civ-spouse,Prof-specialty,Husband,White,Male,0,0,50,United-States,>50K,Behavioral concern raised by colleague David Miles Jr.. Manager Terry Steele ([EMAIL]) to follow up by 2025-05-09. Reference ticket HR-39822.
32,Private,45796,Some-college,10,Married-civ-spouse,Farming-fishing,Husband,White,Male,0,0,60,United-States,<=50K,"Carrie Keller is a strong promotion candidate this year. Discussed with HR (Rachel Fowler DVM, [PHONE]). Budget pre-approved on account [IBAN]."
50,Private,183638,HS-grad,9,Widowed,Sales,Unmarried,White,Female,0,0,40,United-States,<=50K,RAS pour Marguerite du Diaz cette année. Manager : Eric Johnson.
44,Private,193755,Bachelors,13,Divorced,Exec-managerial,Not-in-family,White,Male,0,0,50,United-States,>50K,Performance below target for Mr. Thomas Terrell. Action plan owned by Billy Rogers. Ticket HR-54099.
66,Self-emp-not-inc,28061,7th-8th,4,Widowed,Farming-fishing,Unmarried,White,Male,0,0,50,United-States,<=50K,Alerte comportementale signalée par Ruth Turner DDS au sujet de Karen Schmidt. Suivi RH : [EMAIL].
50,State-gov,288353,Bachelors,13,Married-civ-spouse,Protective-serv,Husband,White,Male,0,0,40,United-States,>50K,RAS pour Natalie Morris cette année. Manager : Eric Munoz.
36,Private,28996,Some-college,10,Married-civ-spouse,Sales,Husband,White,Male,0,0,45,United-States,<=50K,Behavioral concern raised by colleague Eric Nguyen. Manager Teresa Jackson ([EMAIL]) to follow up by 2025-03-14. Reference ticket HR-20314.
25,Private,250038,Assoc-voc,11,Never-married,Adm-clerical,Not-in-family,White,Male,0,0,40,,<=50K,"Dennis Yu on extended leave since 2025-01-28. Backfill discussed with Jeremy Smith, [PHONE]."
35,Private,119992,Assoc-acdm,12,Married-civ-spouse,Craft-repair,Husband,White,Male,0,0,45,United-States,<=50K,Tara Smith flagged a conflict with Daniel Berry. Mediation scheduled. HR follow-up: [EMAIL].
47,Self-emp-not-inc,258498,Some-college,10,Married-civ-spouse,Other-service,Wife,White,Female,0,0,52,United-States,<=50K,"Annual review for Kimberly Stanley: solid contributor, no concern. Manager: Samantha Joyce, contact [EMAIL]."
27,Self-emp-not-inc,151402,HS-grad,9,Married-civ-spouse,Farming-fishing,Husband,White,Male,0,1573,70,United-States,<=50K,Elizabeth Roth flagged a conflict with Erin Barnett. Mediation scheduled. HR follow-up: [EMAIL].
46,State-gov,27802,Assoc-acdm,12,Married-civ-spouse,Tech-support,Husband,White,Male,0,0,38,United-States,>50K,Wendy Perry flagged a conflict with Seth Harper. Mediation scheduled. HR follow-up: [EMAIL].
31,Private,263561,Masters,14,Married-civ-spouse,Exec-managerial,Husband,White,Male,0,0,40,United-States,>50K,Shannon Gentry flagged a conflict with Javier Cook. Mediation scheduled. HR follow-up: [EMAIL].
34,Private,224358,10th,6,Never-married,Other-service,Unmarried,Black,Female,0,0,40,United-States,<=50K,"Jonathan Thompson is a strong promotion candidate this year. Discussed with HR (Beverly Gibson, [PHONE]). Budget pre-approved on account [IBAN]."
33,Local-gov,292217,HS-grad,9,Divorced,Protective-serv,Unmarried,White,Male,0,0,40,United-States,<=50K,Plan d'accompagnement ouvert pour Kimberly Cohen. Coaching confié à Océane Coste ([EMAIL]).
35,Private,148903,HS-grad,9,Divorced,Sales,Unmarried,White,Female,0,0,40,United-States,<=50K,Plan d'accompagnement ouvert pour Roberta Gomez. Coaching confié à Lorraine Laurent-Blondel ([EMAIL]).
38,Federal-gov,48123,Some-college,10,Divorced,Exec-managerial,Not-in-family,White,Female,0,0,40,United-States,<=50K,Strong year for April Antonio Jones. Bonus wired to account [IBAN]. Validated by Debbie Mcdaniel on 2025-12-27.
44,Private,165492,Some-college,10,Married-civ-spouse,Sales,Husband,White,Male,0,0,40,United-States,>50K,Alicia Perez flagged a conflict with Ronald Mckenzie. Mediation scheduled. HR follow-up: [EMAIL].
36,Local-gov,196529,Masters,14,Married-civ-spouse,Prof-specialty,Wife,White,Female,0,0,40,United-States,>50K,Behavioral concern raised by colleague Lauren Moore. Manager Barbara Shelton ([EMAIL]) to follow up by 2025-06-05. Reference ticket HR-86732.
47,Private,102308,Bachelors,13,Married-civ-spouse,Prof-specialty,Husband,White,Male,0,0,50,United-States,>50K,Strong year for Kaitlin Chapman. Bonus wired to account [IBAN]. Validated by John Long on 2025-05-05.
32,Private,26803,Some-college,10,Married-civ-spouse,Machine-op-inspct,Husband,White,Male,0,0,84,United-States,>50K,"Gina Banks on extended leave since 2025-08-06. Backfill discussed with Tyler Baker, [PHONE]."
52,Self-emp-inc,287927,HS-grad,9,Married-civ-spouse,Exec-managerial,Wife,White,Female,15024,0,40,United-States,>50K,"Amy Dunn is a strong promotion candidate this year. Discussed with HR (Steven Becker, [PHONE]). Budget pre-approved on account [IBAN]."
61,State-gov,162678,5th-6th,3,Married-civ-spouse,Transport-moving,Husband,White,Male,0,0,40,United-States,<=50K,RAS pour Ronald Li cette année. Manager : Rémy Renard.
24,Self-emp-not-inc,277700,Some-college,10,Separated,Handlers-cleaners,Own-child,White,Male,0,0,45,United-States,<=50K,Jasmine Robinson flagged a conflict with Jennifer Ramirez. Mediation scheduled. HR follow-up: [EMAIL].
50,Private,107665,Some-college,10,Married-civ-spouse,Sales,Husband,White,Male,0,0,40,United-States,>50K,"Mr. Corey French is a strong promotion candidate this year. Discussed with HR (Erin Vasquez, [PHONE]). Budget pre-approved on account [IBAN]."
19,Private,405526,HS-grad,9,Never-married,Handlers-cleaners,Own-child,White,Male,0,0,40,United-States,<=50K,"Adam Blackwell on extended leave since 2025-05-06. Backfill discussed with Tina Smith, [PHONE]."
39,Federal-gov,206190,HS-grad,9,Never-married,Exec-managerial,Unmarried,White,Female,0,0,45,United-States,<=50K,"Annual review for Shannon Paul Anderson: solid contributor, no concern. Manager: Christopher Wagner, contact [EMAIL]."
39,Private,110713,Bachelors,13,Married-civ-spouse,Sales,Husband,White,Male,0,0,50,United-States,>50K,Onboarding complete for Dawn Stevens. Lydia Brown assigned: Walter Watkins ([EMAIL]). No issues.
28,Private,34335,HS-grad,9,Divorced,Sales,Not-in-family,Amer-Indian-Eskimo,Male,14084,0,40,United-States,>50K,PIP opened 2025-02-16. Coaching assigned to Amy Johnson ([EMAIL]). Review in 90 days. Confidential — HR contact: Teresa Hill.
52,Self-emp-not-inc,194791,Some-college,10,Married-civ-spouse,Craft-repair,Husband,White,Male,0,0,40,United-States,<=50K,James Thompson requested a transfer. Approved by Jessica Bryant. Reach them at [PHONE] for handover. Ticket HR-31430.
18,Private,436163,11th,7,Never-married,Prof-specialty,Own-child,White,Male,0,0,20,United-States,<=50K,Jeremy Davis flagged a conflict with Alex Brown. Mediation scheduled. HR follow-up: [EMAIL].
32,Private,226696,Bachelors,13,Never-married,Exec-managerial,Not-in-family,White,Male,0,0,55,United-States,>50K,Strong year for Heather Nguyen. Bonus wired to account [IBAN]. Validated by Gregg Moore on 2025-12-13.
57,Private,250201,11th,7,Married-civ-spouse,Other-service,Husband,White,Male,0,0,52,United-States,<=50K,PIP opened 2025-11-30. Coaching assigned to Kyle Houston ([EMAIL]). Review in 90 days. Confidential — HR contact: Teresa Jones.
58,Private,289364,Some-college,10,Married-civ-spouse,Exec-managerial,Husband,White,Male,7688,0,45,United-States,>50K,"Nicole Brown on extended leave since 2025-06-18. Backfill discussed with Jesse Shaw, [PHONE]."
42,Private,219591,Bachelors,13,Married-civ-spouse,Adm-clerical,Husband,White,Male,0,0,55,United-States,>50K,Prime versée à Brian Johnson sur le compte [IBAN]. Contrôle : Tammy Morgan.
22,,120572,Some-college,10,Never-married,,Own-child,White,Female,0,0,40,United-States,<=50K,Performance below target for Breanna Grant. Action plan owned by Cameron Golden. Ticket HR-30120.
42,Private,266084,Some-college,10,Married-civ-spouse,Craft-repair,Husband,White,Male,7298,0,45,United-States,>50K,"Kenneth Michael is a strong promotion candidate this year. Discussed with HR (Brady Hines, [PHONE]). Budget pre-approved on account [IBAN]."
43,Private,209894,HS-grad,9,Married-civ-spouse,Adm-clerical,Wife,White,Female,0,0,40,United-States,>50K,Performance below target for Don Glover. Action plan owned by Neil Dennis. Ticket HR-76523.
17,Private,329783,10th,6,Never-married,Sales,Other-relative,White,Female,0,0,10,United-States,<=50K,"Robin Travis on extended leave since 2025-03-05. Backfill discussed with Jennifer White, [PHONE]."
52,Private,210736,Some-college,10,Married-civ-spouse,Exec-managerial,Husband,White,Male,3103,0,55,United-States,>50K,Strong year for Jason Brewer. Bonus wired to account [IBAN]. Validated by Michael Hernandez on 2025-04-18.
58,Self-emp-not-inc,321171,HS-grad,9,Married-civ-spouse,Handlers-cleaners,Husband,White,Male,0,0,40,United-States,<=50K,"Cassie Gilbert on extended leave since 2025-03-17. Rachael Shelton discussed with Steven Thomas, [PHONE]."
39,Local-gov,180686,Masters,14,Married-civ-spouse,Prof-specialty,Husband,White,Male,0,1977,45,United-States,>50K,PIP opened 2025-07-20. Coaching assigned to Jonathon Lewis ([EMAIL]). Review in 90 days. Confidential — HR contact: Kelsey Schneider.
22,Private,356567,Assoc-voc,11,Divorced,Tech-support,Not-in-family,White,Male,0,0,60,United-States,<=50K,Strong year for Adam Smith. Bonus wired to account [IBAN]. Validated by Jeffery Young on 2025-04-14.
34,Self-emp-not-inc,29254,Some-college,10,Married-civ-spouse,Craft-repair,Husband,White,Male,0,0,55,United-States,>50K,Performance below target for Jennifer Martinez. Action plan owned by Marc Freeman. Ticket HR-35058.
26,Self-emp-not-inc,93806,Some-college,10,Married-civ-spouse,Sales,Husband,White,Male,0,0,55,United-States,<=50K,"Desiree Haynes DDS on extended leave since 2025-08-20. Miss Jodi Arnold discussed with George Stone, [PHONE]."
35,,273558,Some-college,10,Never-married,,Not-in-family,Black,Male,0,0,30,United-States,<=50K,Strong year for Danielle Turner. Bonus wired to account [IBAN]. Validated by Kimberly Miller on 2025-06-29.
45,Private,178416,Assoc-voc,11,Divorced,Handlers-cleaners,Not-in-family,White,Female,0,0,40,United-States,<=50K,"Annual review for Dana Knight: solid contributor, no concern. Manager: Gabriella Rivera, contact [EMAIL]."
26,Private,41521,HS-grad,9,Never-married,Other-service,Not-in-family,White,Female,0,0,35,United-States,<=50K,Onboarding complete for Jordan Ramos. Rachel Jones assigned: Nicholas Hess DDS ([EMAIL]). No issues.
58,Local-gov,368797,Masters,14,Widowed,Prof-specialty,Unmarried,White,Male,0,0,35,United-States,>50K,"Bryan Cohen is a strong promotion candidate this year. Discussed with HR (David Lee, [PHONE]). Budget pre-approved on account [IBAN]."
30,Local-gov,131776,Masters,14,Never-married,Adm-clerical,Not-in-family,White,Female,0,0,40,United-States,<=50K,PIP opened 2025-04-22. Coaching assigned to Alexander Conley ([EMAIL]). Review in 90 days. Confidential — HR contact: William Howard.
49,State-gov,391585,Bachelors,13,Married-civ-spouse,Exec-managerial,Husband,White,Male,15024,0,40,United-States,>50K,Strong year for Christopher Mills MD. Bonus wired to account [IBAN]. Validated by Francis Clark DVM on 2025-12-18.
51,Private,103824,HS-grad,9,Never-married,Other-service,Not-in-family,Black,Male,0,0,40,Haiti,<=50K,"Tracy Rodriguez on extended leave since 2025-10-30. Robert Baker discussed with Jennifer Anderson, [PHONE]."
48,Private,131826,Some-college,10,Married-civ-spouse,Adm-clerical,Husband,White,Male,0,0,40,United-States,>50K,"Jacqueline Bridges on extended leave since 2025-03-29. Backfill discussed with Jesse Diaz, [PHONE]."
20,Private,190772,Assoc-acdm,12,Never-married,Other-service,Not-in-family,White,Female,0,0,40,United-States,<=50K,Performance below target for Kathleen Ward. Action plan owned by Alec Day. Ticket HR-92178.
32,Private,208180,Assoc-voc,11,Married-civ-spouse,Tech-support,Wife,White,Female,0,0,24,United-States,>50K,Alerte comportementale signalée par Laurent-Jacques Poulain au sujet Crystal Summers. Suivi RH : [EMAIL].
55,Self-emp-not-inc,477867,Bachelors,13,Married-civ-spouse,Exec-managerial,Husband,White,Male,0,0,40,United-States,>50K,"Kathleen Patterson on extended leave since 2025-07-14. Laurie Williams discussed with Andrew Payne, [PHONE]."
35,Private,187693,HS-grad,9,Never-married,Machine-op-inspct,Own-child,White,Male,0,0,40,United-States,<=50K,Behavioral concern raised by colleague Richard Duran. Manager Daniel Mitchell ([EMAIL]) to follow up by 2025-01-09. Reference ticket HR-83885.
49,Self-emp-inc,44671,Assoc-acdm,12,Married-civ-spouse,Craft-repair,Husband,White,Male,0,0,40,United-States,>50K,"Annual review for Alex Smith: solid contributor, no concern. Manager: Lisa Osborn, contact [EMAIL]."
27,Private,215504,Bachelors,13,Married-civ-spouse,Sales,Husband,White,Male,0,1848,55,United-States,>50K,Performance below target for Justin Wallace. Action plan owned by Dr. David Fletcher. Ticket HR-34877.
24,,33339,Some-college,10,Never-married,,Own-child,White,Male,0,0,20,United-States,<=50K,Strong year for Ashley Miranda. Bonus wired to account [IBAN]. Validated by Adrian Olson on 2025-12-05.
41,Private,287306,Assoc-acdm,12,Married-civ-spouse,Prof-specialty,Husband,White,Male,15024,0,60,United-States,>50K,PIP opened 2025-03-14. Coaching assigned to James Baker ([EMAIL]). Review in 90 days. Confidential — HR contact: Kari Johnson.
45,Private,187370,Masters,14,Divorced,Exec-managerial,Unmarried,White,Male,7430,0,70,United-States,>50K,"Annual review for Connor Schroeder: solid contributor, no concern. Manager: Melissa Evans, contact [EMAIL]."
36,Private,230329,Bachelors,13,Married-civ-spouse,Exec-managerial,Husband,White,Male,0,0,50,United-States,>50K,Mobilité demandée par David Matthews. Richard Adams par Douglas Mendoza le 2025-10-08. Ticket HR-57785.
51,Private,332243,Bachelors,13,Divorced,Prof-specialty,Not-in-family,White,Male,0,0,45,United-States,<=50K,"Jeremiah Torres is a strong promotion candidate this year. Discussed with HR (Brent Turner, [PHONE]). Budget pre-approved on account [IBAN]."
17,Private,365613,10th,6,Never-married,Other-service,Own-child,White,Male,0,0,10,Canada,<=50K,Tracy White requested a transfer. Approved by Jeffrey Long. Reach them at [PHONE] for handover. Ticket HR-52574.
44,Local-gov,196456,Masters,14,Never-married,Prof-specialty,Not-in-family,White,Female,0,1669,40,United-States,<=50K,Behavioral concern raised by colleague Courtney Schwartz. Manager Kevin Johnson ([EMAIL]) to follow up by 2025-10-04. Reference ticket HR-58374.
33,Private,129707,Bachelors,13,Never-married,Adm-clerical,Not-in-family,White,Male,0,0,60,United-States,>50K,"Annual review for Eduardo James: solid contributor, no concern. Manager: Taylor Ayala, contact [EMAIL]."
38,Self-emp-not-inc,77820,HS-grad,9,Married-civ-spouse,Craft-repair,Husband,White,Male,0,0,40,United-States,>50K,RAS pour Susan Wilson cette année. Manager : Roland Petit du Marie.
30,Local-gov,44566,Bachelors,13,Married-civ-spouse,Prof-specialty,Husband,White,Male,0,0,80,United-States,<=50K,Strong year for Shane Osborne. Bonus wired to account [IBAN]. Validated by Brian Jones on 2025-06-04.
33,Private,112941,HS-grad,9,Married-civ-spouse,Machine-op-inspct,Husband,White,Male,0,0,40,United-States,>50K,Amber White flagged a conflict with David Costa. Mediation scheduled. HR follow-up: [EMAIL].
18,Private,302859,HS-grad,9,Never-married,Sales,Own-child,White,Male,0,0,20,United-States,<=50K,"Annual review for Jennifer Mcintyre: solid contributor, no concern. Manager: John Fields, contact [EMAIL]."
61,Self-emp-not-inc,392694,Some-college,10,Divorced,Exec-managerial,Not-in-family,White,Male,0,0,50,United-States,>50K,Onboarding complete for Jonathon Hall. Buddy assigned: Jason Maddox ([EMAIL]). No issues.
22,Private,309178,HS-grad,9,Never-married,Transport-moving,Own-child,White,Male,0,0,40,United-States,<=50K,Strong year for Glenda Bauer. Bonus wired to account [IBAN]. Validated by Bobby Wood on 2025-10-12.
23,Federal-gov,350680,Assoc-acdm,12,Never-married,Exec-managerial,Own-child,White,Female,0,0,40,Poland,<=50K,Jason Aguirre requested a transfer. Approved by Jimmy Robertson. Reach them at [PHONE] for handover. Ticket HR-72181.
50,Federal-gov,20179,Masters,14,Married-civ-spouse,Tech-support,Husband,White,Male,0,0,40,United-States,>50K,"Tammy Neal is a strong promotion candidate this year. Discussed with HR (Theresa Montes, [PHONE]). Budget pre-approved on account [IBAN]."
32,Private,331539,Bachelors,13,Married-civ-spouse,Exec-managerial,Husband,Asian-Pac-Islander,Male,0,0,50,China,>50K,Onboarding complete for Sherry Lewis. Chelsea Edwards assigned: Mrs. Joseph Carpenter ([EMAIL]). No issues.
20,Private,183594,Some-college,10,Never-married,Transport-moving,Own-child,White,Male,0,0,40,United-States,<=50K,"Annual review for Patrick Miller: solid contributor, no concern. Manager: Nathan Brewer, contact [EMAIL]."
65,Private,469602,Bachelors,13,Married-civ-spouse,Sales,Husband,White,Male,0,0,15,United-States,<=50K,"Annual review for Molly Miller: solid contributor, no concern. Manager: Brianna Smith, contact [EMAIL]."
38,Federal-gov,172571,Some-college,10,Divorced,Adm-clerical,Not-in-family,White,Male,0,0,40,United-States,>50K,"Kathleen Bell : bon élément. Référent : Nicole Huber, joignable au [PHONE]."
44,Private,198282,Masters,14,Married-civ-spouse,Exec-managerial,Husband,White,Male,15024,0,40,United-States,>50K,Mrs. Amanda Galloway requested a transfer. Approved by Jessica Smith. Reach them at [PHONE] for handover. Ticket HR-59606.
53,Private,152657,10th,6,Married-civ-spouse,Craft-repair,Husband,Black,Male,0,0,40,United-States,<=50K,"Julie Jones on extended leave since 2025-09-16. Brian Alvarado discussed with Linda Daugherty, [PHONE]."
27,Private,189462,Masters,14,Never-married,Adm-clerical,Not-in-family,White,Female,0,0,46,United-States,<=50K,Behavioral concern raised by colleague Jessica Bailey. Manager Patricia Burch ([EMAIL]) to follow up by 2025-11-03. Reference ticket HR-74954.
51,Self-emp-not-inc,276456,Assoc-acdm,12,Married-civ-spouse,Sales,Husband,White,Male,3103,0,30,United-States,>50K,Plan d'accompagnement ouvert pour Mr. Joseph Simpson. Coaching confié à Simone du Lefèvre ([EMAIL]).
64,Self-emp-not-inc,170421,Some-college,10,Widowed,Craft-repair,Not-in-family,White,Female,0,0,8,United-States,<=50K,Sharon Bates flagged a conflict with Christina Johnson. Mediation scheduled. HR follow-up: [EMAIL].
27,Private,242207,Bachelors,13,Never-married,Tech-support,Own-child,White,Female,0,0,40,United-States,<=50K,PIP opened 2025-07-15. Coaching assigned to Mrs. Anthony Rios ([EMAIL]). Review in 90 days. Confidential — HR contact: Kaylee Powers.
43,Federal-gov,192712,Some-college,10,Married-civ-spouse,Prof-specialty,Wife,White,Female,0,0,40,United-States,>50K,Performance below target for Joshua Garcia. Action plan owned by Joshua Decker. Ticket HR-93477.
48,Self-emp-not-inc,107231,Bachelors,13,Married-civ-spouse,Exec-managerial,Husband,White,Male,99999,0,50,United-States,>50K,Behavioral concern raised by colleague Theresa Williams MD. Manager John Rice ([EMAIL]) to follow up by 2025-09-21. Reference ticket HR-29351.
41,Private,213019,Assoc-voc,11,Married-civ-spouse,Tech-support,Wife,White,Female,0,0,38,United-States,>50K,Strong year for Natasha Williams. Bonus wired to account [IBAN]. Validated by Ana Fuller on 2025-09-30.
46,Self-emp-inc,219962,Bachelors,13,Married-civ-spouse,Machine-op-inspct,Husband,White,Male,7298,0,40,,>50K,Performance below target for Jerome Harris. Action plan owned by John Alvarez. Ticket HR-74295.
39,Private,205359,Assoc-acdm,12,Widowed,Adm-clerical,Unmarried,White,Female,0,0,45,United-States,<=50K,Strong year for Jim Rivera. Bonus wired to account [IBAN]. Validated by Cynthia Frazier on 2025-10-28.
32,Private,302845,HS-grad,9,Married-civ-spouse,Exec-managerial,Wife,White,Female,0,0,48,United-States,<=50K,PIP opened 2025-06-29. Coaching assigned to Alex Long ([EMAIL]). Review in 90 days. Confidential — HR contact: Carrie Gilbert.
46,Federal-gov,219293,HS-grad,9,Married-civ-spouse,Adm-clerical,Husband,Black,Male,0,0,80,United-States,>50K,PIP opened 2025-08-16. Coaching assigned to Leah Moses ([EMAIL]). Review in 90 days. Confidential — HR contact: Robert Reynolds.
31,Private,339482,HS-grad,9,Married-civ-spouse,Craft-repair,Husband,White,Male,0,1848,40,United-States,>50K,"Dawn Fischer on extended leave since 2025-03-11. Backfill discussed with Brittany Montes, [PHONE]."
31,Federal-gov,207301,HS-grad,9,Married-civ-spouse,Adm-clerical,Wife,White,Female,0,0,40,United-States,>50K,"Matthew Downs on extended leave since 2025-06-10. Backfill discussed with Dr. David Prince, [PHONE]."
32,Private,43403,Some-college,10,Divorced,Farming-fishing,Not-in-family,White,Female,0,1590,54,United-States,<=50K,Marvin Rivera flagged a conflict with Debra Rodriguez. Mediation scheduled. HR follow-up: [EMAIL].
43,Private,334991,Some-college,10,Separated,Transport-moving,Unmarried,White,Male,4934,0,51,United-States,>50K,Performance below target for Robert Dalton. Action plan owned by Ronald Davis. Ticket HR-83209.
30,Private,78980,Assoc-voc,11,Married-civ-spouse,Machine-op-inspct,Husband,White,Male,0,0,40,United-States,>50K,David Black flagged a conflict with Patricia Branch. Mediation scheduled. HR follow-up: [EMAIL].
20,,210781,Some-college,10,Never-married,,Own-child,White,Female,0,0,10,United-States,<=50K,Lisa Mendoza requested a transfer. Approved by Andrew Avery. Reach them at [PHONE] for handover. Ticket HR-14595.
32,Private,193042,Prof-school,15,Married-civ-spouse,Sales,Husband,White,Male,15024,0,60,United-States,>50K,Paul Morris requested a transfer. Approved by James Walker. Reach them at [PHONE] for handover. Ticket HR-05752.
43,Private,233130,HS-grad,9,Divorced,Sales,Not-in-family,White,Male,0,0,20,United-States,<=50K,Performance below target for Stacy Payne. Action plan owned by Megan Todd. Ticket HR-06016.
23,Private,297152,Some-college,10,Never-married,Adm-clerical,Own-child,Black,Female,0,0,25,United-States,<=50K,Behavioral concern raised by colleague Stephen Allen. Manager Jessica Ritter ([EMAIL]) to follow up by 2025-11-06. Reference ticket HR-70515.
